{"$id":"schemas/evidentrail/v1/local_file_query_plan.schema.json","$schema":"https://json-schema.org/draft/2020-12/schema","additionalProperties":false,"properties":{"authorized_continuation":{"type":"null"},"caps":{"additionalProperties":false,"properties":{"per_record_bytes":{"maximum":9007199254740991,"minimum":0,"type":"integer"},"records":{"maximum":9007199254740991,"minimum":0,"type":"integer"},"source_bytes":{"maximum":9007199254740991,"minimum":0,"type":"integer"},"wall_time_millis":{"maximum":9007199254740991,"minimum":0,"type":"integer"}},"required":["per_record_bytes","records","source_bytes","wall_time_millis"],"type":"object"},"contract":{"const":"evidentrail.local_file_query_plan","type":"string"},"contract_version":{"const":1,"maximum":9007199254740991,"minimum":0,"type":"integer"},"created_at_unix_nanos":{"pattern":"^-?(0|[1-9][0-9]*)$","type":"string"},"declared_ordering":{"type":"string"},"execute_before_unix_nanos":{"pattern":"^-?(0|[1-9][0-9]*)$","type":"string"},"internal_path_policy_digest":{"pattern":"^internal_path_policy_sha256_[0-9a-f]{64}$","type":"string"},"locator":{"additionalProperties":false,"properties":{"relative_components":{"items":{"additionalProperties":false,"properties":{"byte_length":{"maximum":9007199254740991,"minimum":0,"type":"integer"},"data":{"pattern":"^[A-Za-z0-9_-]*$","type":"string"},"encoding":{"const":"base64url-nopad","type":"string"}},"required":["byte_length","data","encoding"],"type":"object"},"maxItems":4096,"type":"array"},"root":{"additionalProperties":false,"properties":{"byte_length":{"maximum":9007199254740991,"minimum":0,"type":"integer"},"data":{"pattern":"^[A-Za-z0-9_-]*$","type":"string"},"encoding":{"const":"base64url-nopad","type":"string"}},"required":["byte_length","data","encoding"],"type":"object"}},"required":["relative_components","root"],"type":"object"},"policy_digest":{"pattern":"^policy_sha256_[0-9a-f]{64}$","type":"string"},"policy_version":{"maximum":9007199254740991,"minimum":0,"type":"integer"},"repository_identity":{"pattern":"^repo_sha256_[0-9a-f]{64}$","type":"string"},"requested_ordering":{"type":"string"},"retrieval_id":{"pattern":"^ret_[0-9a-f]{64}$","type":"string"},"runtime_profile":{"additionalProperties":false,"properties":{"architecture":{"type":"string"},"certification_profile_digest":{"pattern":"^local_file_certification_profile_sha256_[0-9a-f]{64}$","type":"string"},"deadline_model":{"type":"string"},"filesystem":{"type":"string"},"operating_system":{"type":"string"}},"required":["architecture","certification_profile_digest","deadline_model","filesystem","operating_system"],"type":"object"},"snapshot":{"additionalProperties":false,"properties":{"changed_nanoseconds":{"type":"string"},"changed_seconds":{"type":"string"},"file":{"additionalProperties":false,"properties":{"device":{"type":"string"},"inode":{"type":"string"}},"required":["device","inode"],"type":"object"},"file_type":{"type":"string"},"high_water_exclusive":{"type":"string"},"link_count":{"type":"string"},"mode":{"maximum":9007199254740991,"minimum":0,"type":"integer"},"modified_nanoseconds":{"type":"string"},"modified_seconds":{"type":"string"},"root":{"additionalProperties":false,"properties":{"device":{"type":"string"},"inode":{"type":"string"}},"required":["device","inode"],"type":"object"},"size":{"type":"string"},"start_offset":{"type":"string"}},"required":["changed_nanoseconds","changed_seconds","file","file_type","high_water_exclusive","link_count","mode","modified_nanoseconds","modified_seconds","root","size","start_offset"],"type":"object"},"snapshot_mode":{"type":"string"},"source_identity":{"additionalProperties":false,"properties":{"adapter":{"additionalProperties":false,"properties":{"kind":{"type":"string"},"version":{"type":"string"}},"required":["kind","version"],"type":"object"},"binding":{"additionalProperties":false,"properties":{"digest":{"pattern":"^binding_sha256_[0-9a-f]{64}$","type":"string"},"id":{"pattern":"^bind_[0-9a-f]{64}$","type":"string"},"version":{"maximum":9007199254740991,"minimum":0,"type":"integer"}},"required":["digest","id","version"],"type":"object"},"digest":{"pattern":"^source_sha256_[0-9a-f]{64}$","type":"string"},"proof":{"additionalProperties":false,"properties":{"expires_at_unix_nanos":{"pattern":"^-?(0|[1-9][0-9]*)$","type":"string"},"kind":{"type":"string"},"observed_at_unix_nanos":{"pattern":"^-?(0|[1-9][0-9]*)$","type":"string"}},"required":["expires_at_unix_nanos","kind","observed_at_unix_nanos"],"type":"object"}},"required":["adapter","binding","digest","proof"],"type":"object"},"source_member":{"additionalProperties":false,"properties":{"byte_length":{"maximum":9007199254740991,"minimum":0,"type":"integer"},"data":{"pattern":"^[A-Za-z0-9_-]*$","type":"string"},"encoding":{"const":"base64url-nopad","type":"string"}},"required":["byte_length","data","encoding"],"type":"object"}},"required":["authorized_continuation","caps","contract","contract_version","created_at_unix_nanos","declared_ordering","execute_before_unix_nanos","internal_path_policy_digest","locator","policy_digest","policy_version","repository_identity","requested_ordering","retrieval_id","runtime_profile","snapshot","snapshot_mode","source_identity","source_member"],"title":"evidentrail.local_file_query_plan","type":"object"}