{"authorized_continuation":null,"caps":{"per_record_bytes":8192,"records":1000,"source_bytes":65536,"wall_time_millis":30000},"contract":"evidentrail.local_file_query_plan","contract_version":1,"created_at_unix_nanos":"1700000001000000000","declared_ordering":"single_file_byte_order_v1","execute_before_unix_nanos":"1700000030000000000","internal_path_policy_digest":"internal_path_policy_sha256_6666666666666666666666666666666666666666666666666666666666666666","locator":{"relative_components":[{"byte_length":3,"data":"YXBw","encoding":"base64url-nopad"},{"byte_length":2,"data":"-_8","encoding":"base64url-nopad"}],"root":{"byte_length":8,"data":"L3Zhci9sb2c","encoding":"base64url-nopad"}},"policy_digest":"policy_sha256_4444444444444444444444444444444444444444444444444444444444444444","policy_version":7,"repository_identity":"repo_sha256_3333333333333333333333333333333333333333333333333333333333333333","requested_ordering":"single_file_byte_order_v1","retrieval_id":"ret_5555555555555555555555555555555555555555555555555555555555555555","runtime_profile":{"architecture":"aarch64","certification_profile_digest":"local_file_certification_profile_sha256_7777777777777777777777777777777777777777777777777777777777777777","deadline_model":"cooperative_deadline_between_io_calls_v1","filesystem":"apfs","operating_system":"macos"},"snapshot":{"changed_nanoseconds":"987654321","changed_seconds":"1700000001","file":{"device":"16777220","inode":"1234567890123"},"file_type":"regular","high_water_exclusive":"65536","link_count":"2","mode":33184,"modified_nanoseconds":"123456789","modified_seconds":"1700000000","root":{"device":"18446744073709551615","inode":"9007199254740992"},"size":"65536","start_offset":"0"},"snapshot_mode":"whole_file_fixed_high_water_v1","source_identity":{"adapter":{"kind":"local-file","version":"1.0.0"},"binding":{"digest":"binding_sha256_2222222222222222222222222222222222222222222222222222222222222222","id":"bind_1111111111111111111111111111111111111111111111111111111111111111","version":3},"digest":"source_sha256_2df73541d15fdfc0aca3770d5bb2d5fc1a2118134be8665b4f1f45240cc07ff8","proof":{"expires_at_unix_nanos":"1700000060000000000","kind":"local_file_metadata","observed_at_unix_nanos":"1700000000000000000"}},"source_member":{"byte_length":32,"data":"2p9hUuSP0rwnCLoSr3yFfqBe5CXThCquR2AJA1kvNyk","encoding":"base64url-nopad"}}